{
  "analogy": {
    "limits": "硬幣類比只有兩種結果，真實實驗的差異有大小；而且 p 值小不代表硬幣「一定」不公平，也不代表不公平的程度。",
    "text": "像在猜一枚硬幣公不公平：你丟了 10 次都是正面。p 值就是在問「如果硬幣其實是公平的，連續 10 次正面有多罕見？」罕見到不像話，你才會開始懷疑硬幣。"
  },
  "audience": "沒有統計背景的主管",
  "evidence": [
    {
      "claim": "p 值衡量資料與指定統計模型的不相容程度，不是假設為真的機率，也不衡量效果大小",
      "id": "e_asa",
      "content_sha256": "b0fe0e69c2ab57874049313366b182196c0ca18e9cdf60183bcf384e984efd0e",
      "locator": "concept/asa-p-value-statement.txt",
      "note": "美國統計學會 2016 年 p 值聲明的六項原則之一。",
      "quote": "P-values can indicate how incompatible the data are with a specified statistical model.",
      "status": "verified"
    },
    {
      "claim": "0.05 只是廣泛使用的慣例門檻，不同領域與決策情境會採用不同門檻",
      "id": "e_threshold",
      "reasoning": "門檻是歷史慣例與領域共識，同一份聲明也提醒不應只用是否跨過門檻做結論；本例沒有針對特定領域的來源。",
      "status": "inferred"
    },
    {
      "claim": "新版 5.2% 對舊版 4.8% 是虛構的示範數字",
      "id": "e_example",
      "note": "只用來讓流程具體，不是真實實驗資料。",
      "status": "analogy"
    }
  ],
  "failure_lens": [
    {
      "evidence": [
        "e_threshold"
      ],
      "id": "f_multi",
      "status": "inferred",
      "symptom": "報告裡只挑最漂亮的那個指標講，重跑一次就不見了",
      "what_breaks": "同時測很多指標，總會有一個 p 值碰巧很小"
    },
    {
      "evidence": [
        "e_asa"
      ],
      "id": "f_size",
      "status": "verified",
      "symptom": "p 值很小，但差異小到對營收沒有意義",
      "what_breaks": "樣本很大時，微不足道的差異也會顯著"
    }
  ],
  "glossary": [
    {
      "plain": "計算前先假設「什麼都沒發生、兩邊沒差」。",
      "term": "虛無假設"
    },
    {
      "plain": "p 值小於慣例門檻（常用 0.05），只代表「和沒差不搭」，不代表重要。",
      "term": "顯著"
    },
    {
      "plain": "差異實際有多大，例如轉換率差 0.4 個百分點。",
      "term": "效果大小"
    }
  ],
  "ladder": {
    "analogy": "p 值像是「如果什麼都沒發生，這個結果有多意外」的意外程度。",
    "caveat": "p 值不告訴你效果多大、重不重要；門檻 0.05 是慣例不是物理定律；同時比較很多指標時，小 p 值會變得很容易出現。",
    "truth": "p 值衡量的是資料與「無差異」這個統計模型有多不相容；它不是「假設為真的機率」，也不是「結果純屬巧合的機率」。"
  },
  "language": "zh-TW",
  "mode": "concept",
  "mode_data": {
    "misconceptions": [
      {
        "myth": "p 值 0.03 表示新版有 97% 機率比較好。",
        "reality": "p 值不是任何假設為真的機率；它只是在「沒差」前提下，這種結果有多罕見。"
      },
      {
        "myth": "p 值大於 0.05 表示新舊版一樣。",
        "reality": "沒顯著只代表證據不夠，不代表證明沒差；可能是樣本太少。"
      },
      {
        "myth": "p 值越小，效果越大。",
        "reality": "p 值和效果大小是兩件事；樣本夠大時，很小的差異也會有很小的 p 值。"
      }
    ]
  },
  "one_liner": "p 值只是在說：如果真的沒差，看到這種結果有多罕見。",
  "scenes": [
    {
      "caption": "所有計算都從「新版和舊版其實沒差」這個假設開始。",
      "edges": [
        {
          "from": "n_null",
          "label": "當作前提",
          "to": "n_p"
        },
        {
          "from": "n_data",
          "label": "拿去比對",
          "to": "n_p"
        }
      ],
      "id": "s1",
      "nodes": [
        {
          "evidence": [
            "e_asa"
          ],
          "id": "n_null",
          "label": "假設：新舊版沒有差",
          "note": "統計上叫虛無假設，是 p 值的計算前提。",
          "status": "verified"
        },
        {
          "evidence": [
            "e_example"
          ],
          "id": "n_data",
          "label": "實際觀察到的差異",
          "note": "示範數字：新版轉換率 5.2%，舊版 4.8%。",
          "status": "analogy"
        },
        {
          "evidence": [
            "e_asa"
          ],
          "id": "n_p",
          "label": "p 值：這種差異有多罕見",
          "note": "在「沒差」的前提下，看到至少這麼大的差異的機率。",
          "status": "verified"
        }
      ],
      "title": "先假設什麼都沒發生"
    },
    {
      "caption": "p 值小只代表「結果和沒差的假設很不搭」，接下來還是要看效果大小。",
      "edges": [
        {
          "from": "n_small",
          "label": "還不夠",
          "to": "n_effect"
        },
        {
          "from": "n_effect",
          "label": "一起看",
          "to": "n_decide"
        }
      ],
      "id": "s2",
      "nodes": [
        {
          "evidence": [
            "e_threshold"
          ],
          "id": "n_small",
          "label": "p 值很小",
          "note": "常見門檻 0.05，但門檻是慣例。",
          "status": "inferred"
        },
        {
          "evidence": [
            "e_asa"
          ],
          "id": "n_effect",
          "label": "效果大小才決定值不值得做",
          "note": "p 值不衡量效果大小或重要性。",
          "status": "verified"
        },
        {
          "evidence": [],
          "id": "n_decide",
          "label": "決策：要不要上線",
          "note": "要同時看效果大小、成本與風險。",
          "status": "inferred"
        }
      ],
      "title": "p 值小，然後呢"
    }
  ],
  "teach_back": [
    {
      "answer": "如果新舊版其實沒差，我們看到這種差異的機率有多低；越低越難相信「沒差」。",
      "question": "用一句話跟同事說 p 值是什麼。"
    },
    {
      "answer": "不是。p 值不是「假設為真」或「新版比較好」的機率，它只說資料和「沒差」有多不相容。",
      "question": "p 值 0.03 代表新版有 97% 機率比較好嗎？"
    }
  ],
  "title": "p 值到底在說什麼",
  "trace": [
    {
      "node": "n_null",
      "scene": "s1",
      "step": 1,
      "text": "先假設新舊版真的沒差。"
    },
    {
      "node": "n_data",
      "scene": "s1",
      "step": 2,
      "text": "看實際數據：新版 5.2%、舊版 4.8%（示範數字）。"
    },
    {
      "node": "n_p",
      "scene": "s1",
      "step": 3,
      "text": "算出：如果真的沒差，出現這種差異的機率是 0.03。"
    },
    {
      "node": "n_small",
      "scene": "s2",
      "step": 4,
      "text": "0.03 比慣例門檻 0.05 小，所以說「差異顯著」。"
    },
    {
      "node": "n_effect",
      "scene": "s2",
      "step": 5,
      "text": "但 0.4 個百分點的差異值不值得做，要另外算。"
    },
    {
      "node": "n_decide",
      "scene": "s2",
      "step": 6,
      "text": "把效果大小、成本和風險放在一起，才做決定。"
    }
  ],
  "version": 1
}
